Sheet: current_areas
A1: init_source_name | B1: name_short | C1: name_formal | D1: international_status | E1: sovereignty_status | F1: UN_member_recognition | G1: creation_date | H1: hivent_name
A2: Afghanistan | B2: Afghanistan | C2: Islamic Republic of Afghanistan | D2: F | E2: of:=CONCATENATE(IF([.F2]=193;"F";"");IF(AND([.F2]>0;[.F2]<193);"P";"");IF([.F2]=0;"N";"")) -> F | F2: of:=IF([.D2]="F";193;0) -> 193 | G2: 1989-02-15 | H2: Creation of Afghanistan
A3: Angola | B3: Angola | C3: Republic of Angola | D3: F | E3: of:=CONCATENATE(IF([.F3]=193;"F";"");IF(AND([.F3]>0;[.F3]<193);"P";"");IF([.F3]=0;"N";"")) -> F | F3: of:=IF([.D3]="F";193;0) -> 193 | G3: 1975-11-11 | H3: Creation of Angola
A4: Albania | B4: Albania | C4: Republic of Albania | D4: F | E4: of:=CONCATENATE(IF([.F4]=193;"F";"");IF(AND([.F4]>0;[.F4]<193);"P";"");IF([.F4]=0;"N";"")) -> F | F4: of:=IF([.D4]="F";193;0) -> 193 | G4: 1944-11-01 | H4: Creation of Albania
A5: Andorra | B5: Andorra | C5: Principality of Andorra | D5: F | E5: of:=CONCATENATE(IF([.F5]=193;"F";"");IF(AND([.F5]>0;[.F5]<193);"P";"");IF([.F5]=0;"N";"")) -> F | F5: of:=IF([.D5]="F";193;0) -> 193 | G5: 1944-11-01 | H5: Creation of Andorra
A6: United Arab Emirates | B6: United Arab Emirates | C6: United Arab Emirates | D6: F | E6: of:=CONCATENATE(IF([.F6]=193;"F";"");IF(AND([.F6]>0;[.F6]<193);"P";"");IF([.F6]=0;"N";"")) -> F | F6: of:=IF([.D6]="F";193;0) -> 193 | G6: 1971-12-02 | H6: Creation of United Arab Emirates
A7: Argentina | B7: Argentina | C7: Argentine Republic | D7: F | E7: of:=CONCATENATE(IF([.F7]=193;"F";"");IF(AND([.F7]>0;[.F7]<193);"P";"");IF([.F7]=0;"N";"")) -> F | F7: of:=IF([.D7]="F";193;0) -> 193 | G7: 1816-07-09 | H7: Creation of Argentina
A8: Armenia | B8: Armenia | C8: Republic of Armenia | D8: F | E8: of:=CONCATENATE(IF([.F8]=193;"F";"");IF(AND([.F8]>0;[.F8]<193);"P";"");IF([.F8]=0;"N";"")) -> P | F8: 192 | G8: 1991-09-23 | H8: Creation of Armenia
A9: Antigua and Barbuda | B9: Antigua and Barbuda | C9: Antigua and Barbuda | D9: F | E9: of:=CONCATENATE(IF([.F9]=193;"F";"");IF(AND([.F9]>0;[.F9]<193);"P";"");IF([.F9]=0;"N";"")) -> F | F9: of:=IF([.D9]="F";193;0) -> 193 | G9: 1981-11-01 | H9: Creation of Antigua and Barbuda
A10: Australia | B10: Australia | C10: Commonwealth of Australia | D10: F | E10: of:=CONCATENATE(IF([.F10]=193;"F";"");IF(AND([.F10]>0;[.F10]<193);"P";"");IF([.F10]=0;"N";"")) -> F | F10: of:=IF([.D10]="F";193;0) -> 193 | G10: 1942-10-09 | H10: Creation of Australia
A11: Austria | B11: Austria | C11: Republic of Austria | D11: F | E11: of:=CONCATENATE(IF([.F11]=193;"F";"");IF(AND([.F11]>0;[.F11]<193);"P";"");IF([.F11]=0;"N";"")) -> F | F11: of:=IF([.D11]="F";193;0) -> 193 | G11: 1955-05-15 | H11: Creation of Austria
A12: Azerbaijan | B12: Azerbaijan | C12: Republic of Azerbaijan | D12: F | E12: of:=CONCATENATE(IF([.F12]=193;"F";"");IF(AND([.F12]>0;[.F12]<193);"P";"");IF([.F12]=0;"N";"")) -> F | F12: of:=IF([.D12]="F";193;0) -> 193 | G12: 1991-08-30 | H12: Creation of Azerbaijan
A13: Burundi | B13: Burundi | C13: Republic of Burundi | D13: F | E13: of:=CONCATENATE(IF([.F13]=193;"F";"");IF(AND([.F13]>0;[.F13]<193);"P";"");IF([.F13]=0;"N";"")) -> F | F13: of:=IF([.D13]="F";193;0) -> 193 | G13: 1962-07-01 | H13: Creation of Burundi
A14: Belgium | B14: Belgium | C14: Kingdom of Belgium | D14: F | E14: of:=CONCATENATE(IF([.F14]=193;"F";"");IF(AND([.F14]>0;[.F14]<193);"P";"");IF([.F14]=0;"N";"")) -> F | F14: of:=IF([.D14]="F";193;0) -> 193 | G14: 1945-01-01 | H14: Creation of Belgium
A15: Benin | B15: Benin | C15: Republic of Benin | D15: F | E15: of:=CONCATENATE(IF([.F15]=193;"F";"");IF(AND([.F15]>0;[.F15]<193);"P";"");IF([.F15]=0;"N";"")) -> F | F15: of:=IF([.D15]="F";193;0) -> 193 | G15: 1960-08-01 | H15: Creation of Benin
A16: Burkina Faso | B16: Burkina Faso | C16: Burkina Faso | D16: F | E16: of:=CONCATENATE(IF([.F16]=193;"F";"");IF(AND([.F16]>0;[.F16]<193);"P";"");IF([.F16]=0;"N";"")) -> F | F16: of:=IF([.D16]="F";193;0) -> 193 | G16: 1960-08-05 | H16: Creation of Burkina Faso
A17: Bangladesh | B17: Bangladesh | C17: People's Republic of Bangladesh | D17: F | E17: of:=CONCATENATE(IF([.F17]=193;"F";"");IF(AND([.F17]>0;[.F17]<193);"P";"");IF([.F17]=0;"N";"")) -> F | F17: of:=IF([.D17]="F";193;0) -> 193 | G17: 1971-12-16 | H17: Creation of Bangladesh
A18: Bulgaria | B18: Bulgaria | C18: Republic of Bulgaria | D18: F | E18: of:=CONCATENATE(IF([.F18]=193;"F";"");IF(AND([.F18]>0;[.F18]<193);"P";"");IF([.F18]=0;"N";"")) -> F | F18: of:=IF([.D18]="F";193;0) -> 193 | G18: 1908-10-05 | H18: Creation of Bulgaria
A19: Bahrain | B19: Bahrain | C19: Kingdom of Bahrain | D19: F | E19: of:=CONCATENATE(IF([.F19]=193;"F";"");IF(AND([.F19]>0;[.F19]<193);"P";"");IF([.F19]=0;"N";"")) -> F | F19: of:=IF([.D19]="F";193;0) -> 193 | G19: 1971-12-16 | H19: Creation of Bahrain
A20: Bahamas | B20: The Bahamas | C20: Commonwealth of the Bahamas | D20: F | E20: of:=CONCATENATE(IF([.F20]=193;"F";"");IF(AND([.F20]>0;[.F20]<193);"P";"");IF([.F20]=0;"N";"")) -> F | F20: of:=IF([.D20]="F";193;0) -> 193 | G20: 1973-07-10 | H20: Creation of Bahamas
A21: Bosnia and Herzegovina | B21: Bosnia and Herzegovina | C21: Bosnia and Herzegovina | D21: F | E21: of:=CONCATENATE(IF([.F21]=193;"F";"");IF(AND([.F21]>0;[.F21]<193);"P";"");IF([.F21]=0;"N";"")) -> F | F21: of:=IF([.D21]="F";193;0) -> 193 | G21: 1992-03-03 | H21: Creation of Bosnia and Herzegovina
A22: Belarus | B22: Belarus | C22: Republic of Belarus | D22: F | E22: of:=CONCATENATE(IF([.F22]=193;"F";"");IF(AND([.F22]>0;[.F22]<193);"P";"");IF([.F22]=0;"N";"")) -> F | F22: of:=IF([.D22]="F";193;0) -> 193 | G22: 1991-08-25 | H22: Creation of Belarus
A23: Belize | B23: Belize | C23: Belize | D23: F | E23: of:=CONCATENATE(IF([.F23]=193;"F";"");IF(AND([.F23]>0;[.F23]<193);"P";"");IF([.F23]=0;"N";"")) -> F | F23: of:=IF([.D23]="F";193;0) -> 193 | G23: 1981-09-21 | H23: Creation of Belize
A24: Bolivia | B24: Bolivia | C24: Plurinational State of Bolivia | D24: F | E24: of:=CONCATENATE(IF([.F24]=193;"F";"");IF(AND([.F24]>0;[.F24]<193);"P";"");IF([.F24]=0;"N";"")) -> F | F24: of:=IF([.D24]="F";193;0) -> 193 | G24: 1825-08-06 | H24: Creation of Bolivia
A25: Brazil | B25: Brazil | C25: Federative Republic of Brazil | D25: F | E25: of:=CONCATENATE(IF([.F25]=193;"F";"");IF(AND([.F25]>0;[.F25]<193);"P";"");IF([.F25]=0;"N";"")) -> F | F25: of:=IF([.D25]="F";193;0) -> 193 | G25: 1822-09-07 | H25: Creation of Brazil
A26: Barbados | B26: Barbados | C26: Barbados | D26: F | E26: of:=CONCATENATE(IF([.F26]=193;"F";"");IF(AND([.F26]>0;[.F26]<193);"P";"");IF([.F26]=0;"N";"")) -> F | F26: of:=IF([.D26]="F";193;0) -> 193 | G26: 1966-11-30 | H26: Creation of Barbados
A27: Brunei Darussalam | B27: Brunei | C27: Nation of Brunei, Abode of Peace | D27: F | E27: of:=CONCATENATE(IF([.F27]=193;"F";"");IF(AND([.F27]>0;[.F27]<193);"P";"");IF([.F27]=0;"N";"")) -> F | F27: of:=IF([.D27]="F";193;0) -> 193 | G27: 1984-01-01 | H27: Creation of Brunei Darussalam
A28: Bhutan | B28: Bhutan | C28: Kingdom of Bhutan | D28: F | E28: of:=CONCATENATE(IF([.F28]=193;"F";"");IF(AND([.F28]>0;[.F28]<193);"P";"");IF([.F28]=0;"N";"")) -> F | F28: of:=IF([.D28]="F";193;0) -> 193 | G28: 1634-01-01 | H28: Creation of Bhutan
A29: Botswana | B29: Botswana | C29: Republic of Botswana | D29: F | E29: of:=CONCATENATE(IF([.F29]=193;"F";"");IF(AND([.F29]>0;[.F29]<193);"P";"");IF([.F29]=0;"N";"")) -> F | F29: of:=IF([.D29]="F";193;0) -> 193 | G29: 1966-09-30 | H29: Creation of Botswana
A30: Central African Republic | B30: Central African Republic | C30: Central African Republic | D30: F | E30: of:=CONCATENATE(IF([.F30]=193;"F";"");IF(AND([.F30]>0;[.F30]<193);"P";"");IF([.F30]=0;"N";"")) -> F | F30: of:=IF([.D30]="F";193;0) -> 193 | G30: 1960-08-13 | H30: Creation of Central African Republic
A31: Canada | B31: Canada | C31: Canada | D31: F | E31: of:=CONCATENATE(IF([.F31]=193;"F";"");IF(AND([.F31]>0;[.F31]<193);"P";"");IF([.F31]=0;"N";"")) -> F | F31: of:=IF([.D31]="F";193;0) -> 193 | G31: 1931-12-11 | H31: Creation of Canada
A32: Switzerland | B32: Switzerland | C32: Swiss Confederation | D32: F | E32: of:=CONCATENATE(IF([.F32]=193;"F";"");IF(AND([.F32]>0;[.F32]<193);"P";"");IF([.F32]=0;"N";"")) -> F | F32: of:=IF([.D32]="F";193;0) -> 193 | G32: 1815-01-01 | H32: Creation of Switzerland
A33: Chile | B33: Chile | C33: Republic of Chile | D33: F | E33: of:=CONCATENATE(IF([.F33]=193;"F";"");IF(AND([.F33]>0;[.F33]<193);"P";"");IF([.F33]=0;"N";"")) -> F | F33: of:=IF([.D33]="F";193;0) -> 193 | G33: 1818-02-12 | H33: Creation of Chile
A34: China | B34: China | C34: People's Republic of China | D34: F | E34: of:=CONCATENATE(IF([.F34]=193;"F";"");IF(AND([.F34]>0;[.F34]<193);"P";"");IF([.F34]=0;"N";"")) -> P | F34: 175 | G34: 1949-10-01 | H34: Creation of China
A35: Côte d'Ivoire | B35: Ivory Coast | C35: Republic of Côte d'Ivoire | D35: F | E35: of:=CONCATENATE(IF([.F35]=193;"F";"");IF(AND([.F35]>0;[.F35]<193);"P";"");IF([.F35]=0;"N";"")) -> F | F35: of:=IF([.D35]="F";193;0) -> 193 | G35: 1960-08-07 | H35: Creation of Côte d'Ivoire
A36: Cameroon | B36: Cameroon | C36: Republic of Cameroon | D36: F | E36: of:=CONCATENATE(IF([.F36]=193;"F";"");IF(AND([.F36]>0;[.F36]<193);"P";"");IF([.F36]=0;"N";"")) -> F | F36: of:=IF([.D36]="F";193;0) -> 193 | G36: 1961-10-01 | H36: Creation of Cameroon
A37: Democratic Republic of the Congo | B37: Democratic Republic of the Congo | C37: Democratic Republic of the Congo | D37: F | E37: of:=CONCATENATE(IF([.F37]=193;"F";"");IF(AND([.F37]>0;[.F37]<193);"P";"");IF([.F37]=0;"N";"")) -> F | F37: of:=IF([.D37]="F";193;0) -> 193 | G37: 1960-06-30 | H37: Creation of Democratic Republic of the Congo
A38: Republic of Congo | B38: Republic of the Congo | C38: Republic of the Congo | D38: F | E38: of:=CONCATENATE(IF([.F38]=193;"F";"");IF(AND([.F38]>0;[.F38]<193);"P";"");IF([.F38]=0;"N";"")) -> F | F38: of:=IF([.D38]="F";193;0) -> 193 | G38: 1960-08-15 | H38: Creation of Congo
A39: Cook Islands | B39: Cook Islands | C39: Cook Islands | D39: P | E39: of:=CONCATENATE(IF([.F39]=193;"F";"");IF(AND([.F39]>0;[.F39]<193);"P";"");IF([.F39]=0;"N";"")) -> F | F39: 193 | G39: 1965-08-04 | H39: Creation of Niue and Estasblishment of Free Association to New Zealand
A40: Colombia | B40: Colombia | C40: Republic of Colombia | D40: F | E40: of:=CONCATENATE(IF([.F40]=193;"F";"");IF(AND([.F40]>0;[.F40]<193);"P";"");IF([.F40]=0;"N";"")) -> F | F40: of:=IF([.D40]="F";193;0) -> 193 | G40: 1819-08-07 | H40: Creation of Colombia
A41: Comoros | B41: Comoros | C41: Union of the Comoros | D41: F | E41: of:=CONCATENATE(IF([.F41]=193;"F";"");IF(AND([.F41]>0;[.F41]<193);"P";"");IF([.F41]=0;"N";"")) -> F | F41: of:=IF([.D41]="F";193;0) -> 193 | G41: 1975-07-06 | H41: Creation of Comoros
A42: Cape Verde | B42: Cape Verde | C42: Republic of Cabo Verde | D42: F | E42: of:=CONCATENATE(IF([.F42]=193;"F";"");IF(AND([.F42]>0;[.F42]<193);"P";"");IF([.F42]=0;"N";"")) -> F | F42: of:=IF([.D42]="F";193;0) -> 193 | G42: 1975-07-05 | H42: Creation of Cabo Verde
A43: Costa Rica | B43: Costa Rica | C43: Republic of Costa Rica | D43: F | E43: of:=CONCATENATE(IF([.F43]=193;"F";"");IF(AND([.F43]>0;[.F43]<193);"P";"");IF([.F43]=0;"N";"")) -> F | F43: of:=IF([.D43]="F";193;0) -> 193 | G43: 1838-01-01 | H43: Creation of Costa Rica
A44: Cuba | B44: Cuba | C44: Republic of Cuba | D44: F | E44: of:=CONCATENATE(IF([.F44]=193;"F";"");IF(AND([.F44]>0;[.F44]<193);"P";"");IF([.F44]=0;"N";"")) -> F | F44: of:=IF([.D44]="F";193;0) -> 193 | G44: 1902-05-20 | H44: Creation of Cuba
A45: Northern Cyprus | B45: Northern Cyprus | C45: Turkish Republic of Northern Cyprus | D45: N | E45: of:=CONCATENATE(IF([.F45]=193;"F";"");IF(AND([.F45]>0;[.F45]<193);"P";"");IF([.F45]=0;"N";"")) -> P | F45: 1 | G45: 1983-11-15 | H45: Independende from Republic of Cyprus
A46: Cyprus | B46: Cyprus | C46: Republic of Cyprus | D46: F | E46: of:=CONCATENATE(IF([.F46]=193;"F";"");IF(AND([.F46]>0;[.F46]<193);"P";"");IF([.F46]=0;"N";"")) -> P | F46: 192 | G46: 1960-08-16 | H46: Creation of Cyprus
A47: Czech Republic | B47: Czech Republic | C47: Czech Republic | D47: F | E47: of:=CONCATENATE(IF([.F47]=193;"F";"");IF(AND([.F47]>0;[.F47]<193);"P";"");IF([.F47]=0;"N";"")) -> F | F47: of:=IF([.D47]="F";193;0) -> 193 | G47: 1968-09-20 | H47: Creation of Czech Republic
A48: Germany | B48: Germany | C48: Federal Republic of Germany | D48: F | E48: of:=CONCATENATE(IF([.F48]=193;"F";"");IF(AND([.F48]>0;[.F48]<193);"P";"");IF([.F48]=0;"N";"")) -> F | F48: of:=IF([.D48]="F";193;0) -> 193 | G48: 1991-03-15 | H48: Creation of Germany
A49: Djibouti | B49: Djibouti | C49: Republic of Djibouti | D49: F | E49: of:=CONCATENATE(IF([.F49]=193;"F";"");IF(AND([.F49]>0;[.F49]<193);"P";"");IF([.F49]=0;"N";"")) -> F | F49: of:=IF([.D49]="F";193;0) -> 193 | G49: 1977-06-27 | H49: Creation of Djibouti
A50: Dominica | B50: Dominica | C50: Commonwealth of Dominica | D50: F | E50: of:=CONCATENATE(IF([.F50]=193;"F";"");IF(AND([.F50]>0;[.F50]<193);"P";"");IF([.F50]=0;"N";"")) -> F | F50: of:=IF([.D50]="F";193;0) -> 193 | G50: 1978-11-03 | H50: Creation of Dominica
A51: Denmark | B51: Denmark | C51: Kingdom of Denmark | D51: F | E51: of:=CONCATENATE(IF([.F51]=193;"F";"");IF(AND([.F51]>0;[.F51]<193);"P";"");IF([.F51]=0;"N";"")) -> F | F51: of:=IF([.D51]="F";193;0) -> 193 | G51: 1945-05-05 | H51: Creation of Denmark
A52: Dominican Republic | B52: Dominican Republic | C52: Dominican Republic | D52: F | E52: of:=CONCATENATE(IF([.F52]=193;"F";"");IF(AND([.F52]>0;[.F52]<193);"P";"");IF([.F52]=0;"N";"")) -> F | F52: of:=IF([.D52]="F";193;0) -> 193 | G52: 1924-07-13 | H52: Creation of Dominican Republic
A53: Algeria | B53: Algeria | C53: People's Democratic Republic of Algeria | D53: F | E53: of:=CONCATENATE(IF([.F53]=193;"F";"");IF(AND([.F53]>0;[.F53]<193);"P";"");IF([.F53]=0;"N";"")) -> F | F53: of:=IF([.D53]="F";193;0) -> 193 | G53: 1962-07-03 | H53: Creation of Algeria
A54: Ecuador | B54: Ecuador | C54: Republic of Ecuador | D54: F | E54: of:=CONCATENATE(IF([.F54]=193;"F";"");IF(AND([.F54]>0;[.F54]<193);"P";"");IF([.F54]=0;"N";"")) -> F | F54: of:=IF([.D54]="F";193;0) -> 193 | G54: 1830-05-13 | H54: Creation of Ecuador
A55: Egypt | B55: Egypt | C55: Arab Republic of Egypt | D55: F | E55: of:=CONCATENATE(IF([.F55]=193;"F";"");IF(AND([.F55]>0;[.F55]<193);"P";"");IF([.F55]=0;"N";"")) -> F | F55: of:=IF([.D55]="F";193;0) -> 193 | G55: 1922-02-28 | H55: Creation of Egypt
A56: Eritrea | B56: Eritrea | C56: State of Eritrea | D56: F | E56: of:=CONCATENATE(IF([.F56]=193;"F";"");IF(AND([.F56]>0;[.F56]<193);"P";"");IF([.F56]=0;"N";"")) -> F | F56: of:=IF([.D56]="F";193;0) -> 193 | G56: 1993-05-24 | H56: Creation of Eritrea
A57: Spain | B57: Spain | C57: Kingdom of Spain | D57: F | E57: of:=CONCATENATE(IF([.F57]=193;"F";"");IF(AND([.F57]>0;[.F57]<193);"P";"");IF([.F57]=0;"N";"")) -> F | F57: of:=IF([.D57]="F";193;0) -> 193 | G57: 1814-01-01 | H57: Creation of Spain
A58: Estonia | B58: Estonia | C58: Republic of Estonia | D58: F | E58: of:=CONCATENATE(IF([.F58]=193;"F";"");IF(AND([.F58]>0;[.F58]<193);"P";"");IF([.F58]=0;"N";"")) -> F | F58: of:=IF([.D58]="F";193;0) -> 193 | G58: 1991-08-20 | H58: Creation of Estonia
A59: Ethiopia | B59: Ethiopia | C59: Federal Democratic Republic of Ethiopia | D59: F | E59: of:=CONCATENATE(IF([.F59]=193;"F";"");IF(AND([.F59]>0;[.F59]<193);"P";"");IF([.F59]=0;"N";"")) -> F | F59: of:=IF([.D59]="F";193;0) -> 193 | G59: 1941-05-05 | H59: Creation of Ethiopia
A60: Finland | B60: Finland | C60: Republic of Finland | D60: F | E60: of:=CONCATENATE(IF([.F60]=193;"F";"");IF(AND([.F60]>0;[.F60]<193);"P";"");IF([.F60]=0;"N";"")) -> F | F60: of:=IF([.D60]="F";193;0) -> 193 | G60: 1918-01-04 | H60: Creation of Finland
A61: Fiji | B61: Fiji | C61: Republic of Fiji | D61: F | E61: of:=CONCATENATE(IF([.F61]=193;"F";"");IF(AND([.F61]>0;[.F61]<193);"P";"");IF([.F61]=0;"N";"")) -> F | F61: of:=IF([.D61]="F";193;0) -> 193 | G61: 1970-10-10 | H61: Creation of Fiji
A62: France | B62: France | C62: French Republic | D62: F | E62: of:=CONCATENATE(IF([.F62]=193;"F";"");IF(AND([.F62]>0;[.F62]<193);"P";"");IF([.F62]=0;"N";"")) -> F | F62: of:=IF([.D62]="F";193;0) -> 193 | G62: 1944-01-01 | H62: Creation of France
A63: Federated States of Micronesia | B63: Micronesia | D63: F | E63: of:=CONCATENATE(IF([.F63]=193;"F";"");IF(AND([.F63]>0;[.F63]<193);"P";"");IF([.F63]=0;"N";"")) -> F | F63: of:=IF([.D63]="F";193;0) -> 193 | G63: 1986-11-03 | H63: Creation of Micronesia, Federated States of
A64: Gabon | B64: Gabon | C64: Gabonese Republic | D64: F | E64: of:=CONCATENATE(IF([.F64]=193;"F";"");IF(AND([.F64]>0;[.F64]<193);"P";"");IF([.F64]=0;"N";"")) -> F | F64: of:=IF([.D64]="F";193;0) -> 193 | G64: 1960-08-17 | H64: Creation of Gabon
A65: United Kingdom | B65: United Kingdom | C65: United Kingdom of Great Britain and Northern Ireland | D65: F | E65: of:=CONCATENATE(IF([.F65]=193;"F";"");IF(AND([.F65]>0;[.F65]<193);"P";"");IF([.F65]=0;"N";"")) -> F | F65: of:=IF([.D65]="F";193;0) -> 193 | G65: 1066-01-01 | H65: Creation of United Kingdom of Great Britain and Northern Ireland
A66: Georgia | B66: Georgia | C66: Georgia | D66: F | E66: of:=CONCATENATE(IF([.F66]=193;"F";"");IF(AND([.F66]>0;[.F66]<193);"P";"");IF([.F66]=0;"N";"")) -> F | F66: of:=IF([.D66]="F";193;0) -> 193 | G66: 1991-04-08 | H66: Creation of Georgia
A67: Ghana | B67: Ghana | C67: Republic of Ghana | D67: F | E67: of:=CONCATENATE(IF([.F67]=193;"F";"");IF(AND([.F67]>0;[.F67]<193);"P";"");IF([.F67]=0;"N";"")) -> F | F67: of:=IF([.D67]="F";193;0) -> 193 | G67: 1957-03-06 | H67: Creation of Ghana
A68: Guinea | B68: Guinea | C68: Republic of Guinea | D68: F | E68: of:=CONCATENATE(IF([.F68]=193;"F";"");IF(AND([.F68]>0;[.F68]<193);"P";"");IF([.F68]=0;"N";"")) -> F | F68: of:=IF([.D68]="F";193;0) -> 193 | G68: 1958-10-02 | H68: Creation of Guinea
A69: The Gambia | B69: The Gambia | C69: Republic of the Gambia | D69: F | E69: of:=CONCATENATE(IF([.F69]=193;"F";"");IF(AND([.F69]>0;[.F69]<193);"P";"");IF([.F69]=0;"N";"")) -> F | F69: of:=IF([.D69]="F";193;0) -> 193 | G69: 1965-02-18 | H69: Creation of Gambia
A70: Guinea-Bissau | B70: Guinea-Bissau | C70: Republic of Guinea-Bissau | D70: F | E70: of:=CONCATENATE(IF([.F70]=193;"F";"");IF(AND([.F70]>0;[.F70]<193);"P";"");IF([.F70]=0;"N";"")) -> F | F70: of:=IF([.D70]="F";193;0) -> 193 | G70: 1974-09-10 | H70: Creation of Guinea Bissau
A71: Equatorial Guinea | B71: Equatorial Guinea | C71: Republic of Equatorial Guinea | D71: F | E71: of:=CONCATENATE(IF([.F71]=193;"F";"");IF(AND([.F71]>0;[.F71]<193);"P";"");IF([.F71]=0;"N";"")) -> F | F71: of:=IF([.D71]="F";193;0) -> 193 | G71: 1968-10-12 | H71: Creation of Equatorial Guinea
A72: Greece | B72: Greece | C72: Hellenic Republic | D72: F | E72: of:=CONCATENATE(IF([.F72]=193;"F";"");IF(AND([.F72]>0;[.F72]<193);"P";"");IF([.F72]=0;"N";"")) -> F | F72: of:=IF([.D72]="F";193;0) -> 193 | G72: 1944-01-01 | H72: Creation of Greece
A73: Grenada | B73: Grenada | C73: Grenada | D73: F | E73: of:=CONCATENATE(IF([.F73]=193;"F";"");IF(AND([.F73]>0;[.F73]<193);"P";"");IF([.F73]=0;"N";"")) -> F | F73: of:=IF([.D73]="F";193;0) -> 193 | G73: 1974-02-07 | H73: Creation of Grenada
A74: Guatemala | B74: Guatemala | C74: Republic of Guatemala | D74: F | E74: of:=CONCATENATE(IF([.F74]=193;"F";"");IF(AND([.F74]>0;[.F74]<193);"P";"");IF([.F74]=0;"N";"")) -> F | F74: of:=IF([.D74]="F";193;0) -> 193 | G74: 1838-01-01 | H74: Creation of Guatemala
A75: Guyana | B75: Guyana | C75: Co-operative Republic of Guyana | D75: F | E75: of:=CONCATENATE(IF([.F75]=193;"F";"");IF(AND([.F75]>0;[.F75]<193);"P";"");IF([.F75]=0;"N";"")) -> F | F75: of:=IF([.D75]="F";193;0) -> 193 | G75: 1966-05-26 | H75: Creation of Guyana
A76: Honduras | B76: Honduras | C76: Republic of Honduras | D76: F | E76: of:=CONCATENATE(IF([.F76]=193;"F";"");IF(AND([.F76]>0;[.F76]<193);"P";"");IF([.F76]=0;"N";"")) -> F | F76: of:=IF([.D76]="F";193;0) -> 193 | G76: 1925-01-01 | H76: Creation of Honduras
A77: Croatia | B77: Croatia | C77: Republic of Croatia | D77: F | E77: of:=CONCATENATE(IF([.F77]=193;"F";"");IF(AND([.F77]>0;[.F77]<193);"P";"");IF([.F77]=0;"N";"")) -> F | F77: of:=IF([.D77]="F";193;0) -> 193 | G77: 1991-10-08 | H77: Creation of Croatia
A78: Haiti | B78: Haiti | C78: Republic of Haiti | D78: F | E78: of:=CONCATENATE(IF([.F78]=193;"F";"");IF(AND([.F78]>0;[.F78]<193);"P";"");IF([.F78]=0;"N";"")) -> F | F78: of:=IF([.D78]="F";193;0) -> 193 | G78: 1934-08-01 | H78: Creation of Haiti
A79: Hungary | B79: Hungary | C79: Hungary | D79: F | E79: of:=CONCATENATE(IF([.F79]=193;"F";"");IF(AND([.F79]>0;[.F79]<193);"P";"");IF([.F79]=0;"N";"")) -> F | F79: of:=IF([.D79]="F";193;0) -> 193 | G79: 1956-01-01 | H79: Creation of Hungary
A80: Indonesia | B80: Indonesia | C80: Republic of Indonesia | D80: F | E80: of:=CONCATENATE(IF([.F80]=193;"F";"");IF(AND([.F80]>0;[.F80]<193);"P";"");IF([.F80]=0;"N";"")) -> F | F80: of:=IF([.D80]="F";193;0) -> 193 | G80: 1949-12-27 | H80: Creation of Indonesia
A81: India | B81: India | C81: Republic of India | D81: F | E81: of:=CONCATENATE(IF([.F81]=193;"F";"");IF(AND([.F81]>0;[.F81]<193);"P";"");IF([.F81]=0;"N";"")) -> F | F81: of:=IF([.D81]="F";193;0) -> 193 | G81: 1947-08-15 | H81: Creation of India
A82: Ireland | B82: Ireland | C82: Ireland | D82: F | E82: of:=CONCATENATE(IF([.F82]=193;"F";"");IF(AND([.F82]>0;[.F82]<193);"P";"");IF([.F82]=0;"N";"")) -> F | F82: of:=IF([.D82]="F";193;0) -> 193 | G82: 1931-12-11 | H82: Creation of Ireland
A83: Iran | B83: Iran | C83: Islamic Republic of Iran | D83: F | E83: of:=CONCATENATE(IF([.F83]=193;"F";"");IF(AND([.F83]>0;[.F83]<193);"P";"");IF([.F83]=0;"N";"")) -> F | F83: of:=IF([.D83]="F";193;0) -> 193 | G83: 1946-05-01 | H83: Creation of Iran
A84: Iraq | B84: Iraq | C84: Republic of Iraq | D84: F | E84: of:=CONCATENATE(IF([.F84]=193;"F";"");IF(AND([.F84]>0;[.F84]<193);"P";"");IF([.F84]=0;"N";"")) -> F | F84: of:=IF([.D84]="F";193;0) -> 193 | G84: 2004-06-28 | H84: Creation of Iraq
A85: Iceland | B85: Iceland | C85: Iceland | D85: F | E85: of:=CONCATENATE(IF([.F85]=193;"F";"");IF(AND([.F85]>0;[.F85]<193);"P";"");IF([.F85]=0;"N";"")) -> F | F85: of:=IF([.D85]="F";193;0) -> 193 | G85: 1944-06-17 | H85: Creation of Iceland
A86: Israel | B86: Israel | C86: State of Israel | D86: F | E86: of:=CONCATENATE(IF([.F86]=193;"F";"");IF(AND([.F86]>0;[.F86]<193);"P";"");IF([.F86]=0;"N";"")) -> P | F86: of:=IF([.D86]="F";193-32;0) -> 161 | G86: 1948-05-14 | H86: Creation of Israel
A87: Italy | B87: Italy | C87: Italian Republic | D87: F | E87: of:=CONCATENATE(IF([.F87]=193;"F";"");IF(AND([.F87]>0;[.F87]<193);"P";"");IF([.F87]=0;"N";"")) -> F | F87: of:=IF([.D87]="F";193;0) -> 193 | G87: 1945-04-25 | H87: Creation of Italy
A88: Jamaica | B88: Jamaica | C88: Jamaica | D88: F | E88: of:=CONCATENATE(IF([.F88]=193;"F";"");IF(AND([.F88]>0;[.F88]<193);"P";"");IF([.F88]=0;"N";"")) -> F | F88: of:=IF([.D88]="F";193;0) -> 193 | G88: 1962-08-06 | H88: Creation of Jamaica
A89: Jordan | B89: Jordan | C89: Hashemite Kingdom of Jordan | D89: F | E89: of:=CONCATENATE(IF([.F89]=193;"F";"");IF(AND([.F89]>0;[.F89]<193);"P";"");IF([.F89]=0;"N";"")) -> F | F89: of:=IF([.D89]="F";193;0) -> 193 | G89: 1958-08-02 | H89: Creation of Jordan
A90: Japan | B90: Japan | C90: Japan | D90: F | E90: of:=CONCATENATE(IF([.F90]=193;"F";"");IF(AND([.F90]>0;[.F90]<193);"P";"");IF([.F90]=0;"N";"")) -> F | F90: of:=IF([.D90]="F";193;0) -> 193 | G90: 1952-04-28 | H90: Creation of Japan
A91: Kazakhstan | B91: Kazakhstan | C91: Republic of Kazakhstan | D91: F | E91: of:=CONCATENATE(IF([.F91]=193;"F";"");IF(AND([.F91]>0;[.F91]<193);"P";"");IF([.F91]=0;"N";"")) -> F | F91: of:=IF([.D91]="F";193;0) -> 193 | G91: 1991-12-16 | H91: Creation of Kazakhstan
A92: Kenya | B92: Kenya | C92: Republic of Kenya | D92: F | E92: of:=CONCATENATE(IF([.F92]=193;"F";"");IF(AND([.F92]>0;[.F92]<193);"P";"");IF([.F92]=0;"N";"")) -> F | F92: of:=IF([.D92]="F";193;0) -> 193 | G92: 1963-12-12 | H92: Creation of Kenya
A93: Kyrgyzstan | B93: Kyrgyzstan | C93: Kyrgyz Republic | D93: F | E93: of:=CONCATENATE(IF([.F93]=193;"F";"");IF(AND([.F93]>0;[.F93]<193);"P";"");IF([.F93]=0;"N";"")) -> F | F93: of:=IF([.D93]="F";193;0) -> 193 | G93: 1991-08-31 | H93: Creation of Kyrgyzstan
A94: Cambodia | B94: Cambodia | C94: Kingdom of Cambodia | D94: F | E94: of:=CONCATENATE(IF([.F94]=193;"F";"");IF(AND([.F94]>0;[.F94]<193);"P";"");IF([.F94]=0;"N";"")) -> F | F94: of:=IF([.D94]="F";193;0) -> 193 | G94: 1953-11-09 | H94: Creation of Cambodia
A95: Kiribati | B95: Kiribati | C95: Republic of Kiribati | D95: F | E95: of:=CONCATENATE(IF([.F95]=193;"F";"");IF(AND([.F95]>0;[.F95]<193);"P";"");IF([.F95]=0;"N";"")) -> F | F95: of:=IF([.D95]="F";193;0) -> 193 | G95: 1979-07-12 | H95: Creation of Kiribati
A96: Saint Kitts and Nevis | B96: Saint Kitts and Nevis | C96: Federation of Saint Christopher and Nevis | D96: F | E96: of:=CONCATENATE(IF([.F96]=193;"F";"");IF(AND([.F96]>0;[.F96]<193);"P";"");IF([.F96]=0;"N";"")) -> F | F96: of:=IF([.D96]="F";193;0) -> 193 | G96: 1983-09-19 | H96: Creation of Saint Kitts and Nevis
A97: Republic of Korea | B97: South Korea | D97: F | E97: of:=CONCATENATE(IF([.F97]=193;"F";"");IF(AND([.F97]>0;[.F97]<193);"P";"");IF([.F97]=0;"N";"")) -> P | F97: 192 | G97: 1948-08-15 | H97: Creation of Republic of Korea
A98: Kosovo | B98: Kosovo | C98: Republic of Kosovo | D98: P | E98: of:=CONCATENATE(IF([.F98]=193;"F";"");IF(AND([.F98]>0;[.F98]<193);"P";"");IF([.F98]=0;"N";"")) -> P | F98: 108 | G98: 2008-02-17 | H98: Declaration of Independence from Serbia
A99: Kuwait | B99: Kuwait | C99: State of Kuwait | D99: F | E99: of:=CONCATENATE(IF([.F99]=193;"F";"");IF(AND([.F99]>0;[.F99]<193);"P";"");IF([.F99]=0;"N";"")) -> F | F99: of:=IF([.D99]="F";193;0) -> 193 | G99: 1991-02-01 | H99: Creation of Kuwait
A100: Lao PDR | B100: Laos | C100: Lao People's Democratic Republic | D100: F | E100: of:=CONCATENATE(IF([.F100]=193;"F";"");IF(AND([.F100]>0;[.F100]<193);"P";"");IF([.F100]=0;"N";"")) -> F | F100: of:=IF([.D100]="F";193;0) -> 193 | G100: 1953-10-22 | H100: Creation of Lao People’s Democratic Republic
A101: Lebanon | B101: Lebanon | C101: Lebanese Republic | D101: F | E101: of:=CONCATENATE(IF([.F101]=193;"F";"");IF(AND([.F101]>0;[.F101]<193);"P";"");IF([.F101]=0;"N";"")) -> F | F101: of:=IF([.D101]="F";193;0) -> 193 | G101: 1946-12-31 | H101: Creation of Lebanon
A102: Liberia | B102: Liberia | C102: Republic of Liberia | D102: F | E102: of:=CONCATENATE(IF([.F102]=193;"F";"");IF(AND([.F102]>0;[.F102]<193);"P";"");IF([.F102]=0;"N";"")) -> F | F102: of:=IF([.D102]="F";193;0) -> 193 | G102: 1847-07-26 | H102: Creation of Liberia
A103: Libya | B103: Libya | C103: State of Libya | D103: F | E103: of:=CONCATENATE(IF([.F103]=193;"F";"");IF(AND([.F103]>0;[.F103]<193);"P";"");IF([.F103]=0;"N";"")) -> F | F103: of:=IF([.D103]="F";193;0) -> 193 | G103: 1951-12-24 | H103: Creation of Libya
A104: Saint Lucia | B104: Saint Lucia | C104: Saint Lucia | D104: F | E104: of:=CONCATENATE(IF([.F104]=193;"F";"");IF(AND([.F104]>0;[.F104]<193);"P";"");IF([.F104]=0;"N";"")) -> F | F104: of:=IF([.D104]="F";193;0) -> 193 | G104: 1979-02-22 | H104: Creation of Saint Lucia
A105: Liechtenstein | B105: Liechtenstein | C105: Principality of Liechtenstein | D105: F | E105: of:=CONCATENATE(IF([.F105]=193;"F";"");IF(AND([.F105]>0;[.F105]<193);"P";"");IF([.F105]=0;"N";"")) -> F | F105: of:=IF([.D105]="F";193;0) -> 193 | G105: 1866-08-24 | H105: Creation of Liechtenstein
A106: Sri Lanka | B106: Sri Lanka | C106: Democratic Socialist Republic of Sri Lanka | D106: F | E106: of:=CONCATENATE(IF([.F106]=193;"F";"");IF(AND([.F106]>0;[.F106]<193);"P";"");IF([.F106]=0;"N";"")) -> F | F106: of:=IF([.D106]="F";193;0) -> 193 | G106: 1948-02-04 | H106: Creation of Sri Lanka
A107: Lesotho | B107: Lesotho | C107: Kingdom of Lesotho | D107: F | E107: of:=CONCATENATE(IF([.F107]=193;"F";"");IF(AND([.F107]>0;[.F107]<193);"P";"");IF([.F107]=0;"N";"")) -> F | F107: of:=IF([.D107]="F";193;0) -> 193 | G107: 1966-10-04 | H107: Creation of Lesotho
A108: Lithuania | B108: Lithuania | C108: Republic of Lithuania | D108: F | E108: of:=CONCATENATE(IF([.F108]=193;"F";"");IF(AND([.F108]>0;[.F108]<193);"P";"");IF([.F108]=0;"N";"")) -> F | F108: of:=IF([.D108]="F";193;0) -> 193 | G108: 1990-03-11 | H108: Creation of Lithuania
A109: Luxembourg | B109: Luxembourg | C109: Grand Duchy of Luxembourg | D109: F | E109: of:=CONCATENATE(IF([.F109]=193;"F";"");IF(AND([.F109]>0;[.F109]<193);"P";"");IF([.F109]=0;"N";"")) -> F | F109: of:=IF([.D109]="F";193;0) -> 193 | G109: 1945-01-01 | H109: Creation of Luxembourg
A110: Latvia | B110: Latvia | C110: Republic of Latvia | D110: F | E110: of:=CONCATENATE(IF([.F110]=193;"F";"");IF(AND([.F110]>0;[.F110]<193);"P";"");IF([.F110]=0;"N";"")) -> F | F110: of:=IF([.D110]="F";193;0) -> 193 | G110: 1990-05-04 | H110: Creation of Latvia
A111: Morocco | B111: Morocco | C111: Kingdom of Morocco | D111: F | E111: of:=CONCATENATE(IF([.F111]=193;"F";"");IF(AND([.F111]>0;[.F111]<193);"P";"");IF([.F111]=0;"N";"")) -> F | F111: of:=IF([.D111]="F";193;0) -> 193 | G111: 1956-04-07 | H111: Creation of Morocco
A112: Monaco | B112: Monaco | C112: Principality of Monaco | D112: F | E112: of:=CONCATENATE(IF([.F112]=193;"F";"");IF(AND([.F112]>0;[.F112]<193);"P";"");IF([.F112]=0;"N";"")) -> F | F112: of:=IF([.D112]="F";193;0) -> 193 | G112: 1945-01-01 | H112: Creation of Monaco
A113: Moldova | B113: Moldova | C113: Republic of Moldova | D113: F | E113: of:=CONCATENATE(IF([.F113]=193;"F";"");IF(AND([.F113]>0;[.F113]<193);"P";"");IF([.F113]=0;"N";"")) -> F | F113: of:=IF([.D113]="F";193;0) -> 193 | G113: 1991-08-27 | H113: Creation of Republic of Moldova
A114: Madagascar | B114: Madagascar | C114: Republic of Madagascar | D114: F | E114: of:=CONCATENATE(IF([.F114]=193;"F";"");IF(AND([.F114]>0;[.F114]<193);"P";"");IF([.F114]=0;"N";"")) -> F | F114: of:=IF([.D114]="F";193;0) -> 193 | G114: 1960-06-26 | H114: Creation of Madagascar
A115: Maldives | B115: Maldives | C115: Republic of Maldives | D115: F | E115: of:=CONCATENATE(IF([.F115]=193;"F";"");IF(AND([.F115]>0;[.F115]<193);"P";"");IF([.F115]=0;"N";"")) -> F | F115: of:=IF([.D115]="F";193;0) -> 193 | G115: 1965-07-26 | H115: Creation of Maldives
A116: Mexico | B116: Mexico | C116: United Mexican States | D116: F | E116: of:=CONCATENATE(IF([.F116]=193;"F";"");IF(AND([.F116]>0;[.F116]<193);"P";"");IF([.F116]=0;"N";"")) -> F | F116: of:=IF([.D116]="F";193;0) -> 193 | G116: 1864-01-01 | H116: Creation of Mexico
A117: Marshall Islands | B117: Marshall Islands | C117: Republic of the Marshall Islands | D117: F | E117: of:=CONCATENATE(IF([.F117]=193;"F";"");IF(AND([.F117]>0;[.F117]<193);"P";"");IF([.F117]=0;"N";"")) -> F | F117: of:=IF([.D117]="F";193;0) -> 193 | G117: 1986-10-21 | H117: Creation of Marshall Islands
A118: Macedonia | B118: Macedonia | C118: Republic of Macedonia | D118: F | E118: of:=CONCATENATE(IF([.F118]=193;"F";"");IF(AND([.F118]>0;[.F118]<193);"P";"");IF([.F118]=0;"N";"")) -> F | F118: of:=IF([.D118]="F";193;0) -> 193 | G118: 1991-09-08 | H118: Creation of The former Yugoslav Republic of Macedonia
A119: Mali | B119: Mali | C119: Republic of Mali | D119: F | E119: of:=CONCATENATE(IF([.F119]=193;"F";"");IF(AND([.F119]>0;[.F119]<193);"P";"");IF([.F119]=0;"N";"")) -> F | F119: of:=IF([.D119]="F";193;0) -> 193 | G119: 1960-09-22 | H119: Creation of Mali
A120: Malta | B120: Malta | C120: Republic of Malta | D120: F | E120: of:=CONCATENATE(IF([.F120]=193;"F";"");IF(AND([.F120]>0;[.F120]<193);"P";"");IF([.F120]=0;"N";"")) -> F | F120: of:=IF([.D120]="F";193;0) -> 193 | G120: 1964-09-21 | H120: Creation of Malta
A121: Myanmar | B121: Myanmar | C121: Republic of the Union of Myanmar | D121: F | E121: of:=CONCATENATE(IF([.F121]=193;"F";"");IF(AND([.F121]>0;[.F121]<193);"P";"");IF([.F121]=0;"N";"")) -> F | F121: of:=IF([.D121]="F";193;0) -> 193 | G121: 1948-01-04 | H121: Creation of Myanmar
A122: Montenegro | B122: Montenegro | C122: Montenegro | D122: F | E122: of:=CONCATENATE(IF([.F122]=193;"F";"");IF(AND([.F122]>0;[.F122]<193);"P";"");IF([.F122]=0;"N";"")) -> F | F122: of:=IF([.D122]="F";193;0) -> 193 | G122: 2006-05-21 | H122: Creation of Montenegro
A123: Mongolia | B123: Mongolia | C123: Mongolia | D123: F | E123: of:=CONCATENATE(IF([.F123]=193;"F";"");IF(AND([.F123]>0;[.F123]<193);"P";"");IF([.F123]=0;"N";"")) -> F | F123: of:=IF([.D123]="F";193;0) -> 193 | G123: 1921-03-13 | H123: Creation of Mongolia
A124: Mozambique | B124: Mozambique | C124: Republic of Mozambique | D124: F | E124: of:=CONCATENATE(IF([.F124]=193;"F";"");IF(AND([.F124]>0;[.F124]<193);"P";"");IF([.F124]=0;"N";"")) -> F | F124: of:=IF([.D124]="F";193;0) -> 193 | G124: 1975-06-25 | H124: Creation of Mozambique
A125: Mauritania | B125: Mauritania | C125: Islamic Republic of Mauritania | D125: F | E125: of:=CONCATENATE(IF([.F125]=193;"F";"");IF(AND([.F125]>0;[.F125]<193);"P";"");IF([.F125]=0;"N";"")) -> F | F125: of:=IF([.D125]="F";193;0) -> 193 | G125: 1960-11-28 | H125: Creation of Mauritania
A126: Mauritius | B126: Mauritius | C126: Republic of Mauritius | D126: F | E126: of:=CONCATENATE(IF([.F126]=193;"F";"");IF(AND([.F126]>0;[.F126]<193);"P";"");IF([.F126]=0;"N";"")) -> F | F126: of:=IF([.D126]="F";193;0) -> 193 | G126: 1968-03-12 | H126: Creation of Mauritius
A127: Malawi | B127: Malawi | C127: Republic of Malawi | D127: F | E127: of:=CONCATENATE(IF([.F127]=193;"F";"");IF(AND([.F127]>0;[.F127]<193);"P";"");IF([.F127]=0;"N";"")) -> F | F127: of:=IF([.D127]="F";193;0) -> 193 | G127: 1964-07-06 | H127: Creation of Malawi
A128: Malaysia | B128: Malaysia | C128: Malaysia | D128: F | E128: of:=CONCATENATE(IF([.F128]=193;"F";"");IF(AND([.F128]>0;[.F128]<193);"P";"");IF([.F128]=0;"N";"")) -> F | F128: of:=IF([.D128]="F";193;0) -> 193 | G128: 1957-08-31 | H128: Creation of Malaysia
A129: Namibia | B129: Namibia | C129: Republic of Namibia | D129: F | E129: of:=CONCATENATE(IF([.F129]=193;"F";"");IF(AND([.F129]>0;[.F129]<193);"P";"");IF([.F129]=0;"N";"")) -> F | F129: of:=IF([.D129]="F";193;0) -> 193 | G129: 1990-03-21 | H129: Creation of Namibia
A130: Niger | B130: Niger | C130: Republic of Niger | D130: F | E130: of:=CONCATENATE(IF([.F130]=193;"F";"");IF(AND([.F130]>0;[.F130]<193);"P";"");IF([.F130]=0;"N";"")) -> F | F130: of:=IF([.D130]="F";193;0) -> 193 | G130: 1960-08-03 | H130: Creation of Niger
A131: Nigeria | B131: Nigeria | C131: Federal Republic of Nigeria | D131: F | E131: of:=CONCATENATE(IF([.F131]=193;"F";"");IF(AND([.F131]>0;[.F131]<193);"P";"");IF([.F131]=0;"N";"")) -> F | F131: of:=IF([.D131]="F";193;0) -> 193 | G131: 1960-10-01 | H131: Creation of Nigeria
A132: Nicaragua | B132: Nicaragua | C132: Republic of Nicaragua | D132: F | E132: of:=CONCATENATE(IF([.F132]=193;"F";"");IF(AND([.F132]>0;[.F132]<193);"P";"");IF([.F132]=0;"N";"")) -> F | F132: of:=IF([.D132]="F";193;0) -> 193 | G132: 1933-01-01 | H132: Creation of Nicaragua
A133: Niue | B133: Niue | C133: Niue | D133: P | E133: of:=CONCATENATE(IF([.F133]=193;"F";"");IF(AND([.F133]>0;[.F133]<193);"P";"");IF([.F133]=0;"N";"")) -> F | F133: 193 | G133: 1974-10-19 | H133: Creation of Niue and Estasblishment of Free Association to New Zealand
A134: Netherlands | B134: Netherlands | C134: Kingdom of the Netherlands | D134: F | E134: of:=CONCATENATE(IF([.F134]=193;"F";"");IF(AND([.F134]>0;[.F134]<193);"P";"");IF([.F134]=0;"N";"")) -> F | F134: of:=IF([.D134]="F";193;0) -> 193 | G134: 1945-01-01 | H134: Creation of Netherlands
A135: Norway | B135: Norway | C135: Kingdom of Norway | D135: F | E135: of:=CONCATENATE(IF([.F135]=193;"F";"");IF(AND([.F135]>0;[.F135]<193);"P";"");IF([.F135]=0;"N";"")) -> F | F135: of:=IF([.D135]="F";193;0) -> 193 | G135: 1945-05-09 | H135: Creation of Norway
A136: Nepal | B136: Nepal | C136: Federal Democratic Republic of Nepal | D136: F | E136: of:=CONCATENATE(IF([.F136]=193;"F";"");IF(AND([.F136]>0;[.F136]<193);"P";"");IF([.F136]=0;"N";"")) -> F | F136: of:=IF([.D136]="F";193;0) -> 193 | G136: 1768-01-01 | H136: Creation of Nepal
A137: Nauru | B137: Nauru | C137: Republic of Nauru | D137: F | E137: of:=CONCATENATE(IF([.F137]=193;"F";"");IF(AND([.F137]>0;[.F137]<193);"P";"");IF([.F137]=0;"N";"")) -> F | F137: of:=IF([.D137]="F";193;0) -> 193 | G137: 1968-01-31 | H137: Creation of Nauru
A138: New Zealand | B138: New Zealand | C138: New Zealand | D138: F | E138: of:=CONCATENATE(IF([.F138]=193;"F";"");IF(AND([.F138]>0;[.F138]<193);"P";"");IF([.F138]=0;"N";"")) -> F | F138: of:=IF([.D138]="F";193;0) -> 193 | G138: 1947-11-25 | H138: Creation of New Zealand
A139: Oman | B139: Oman | C139: Sultanate of Oman | D139: F | E139: of:=CONCATENATE(IF([.F139]=193;"F";"");IF(AND([.F139]>0;[.F139]<193);"P";"");IF([.F139]=0;"N";"")) -> F | F139: of:=IF([.D139]="F";193;0) -> 193 | G139: 1743-01-01 | H139: Creation of Oman
A140: Pakistan | B140: Pakistan | C140: Islamic Republic of Pakistan | D140: F | E140: of:=CONCATENATE(IF([.F140]=193;"F";"");IF(AND([.F140]>0;[.F140]<193);"P";"");IF([.F140]=0;"N";"")) -> F | F140: of:=IF([.D140]="F";193;0) -> 193 | G140: 1956-03-23 | H140: Creation of Pakistan
A141: Panama | B141: Panama | C141: Republic of Panama | D141: F | E141: of:=CONCATENATE(IF([.F141]=193;"F";"");IF(AND([.F141]>0;[.F141]<193);"P";"");IF([.F141]=0;"N";"")) -> F | F141: of:=IF([.D141]="F";193;0) -> 193 | G141: 1990-01-12 | H141: Creation of Panama
A142: Peru | B142: Peru | C142: Republic of Peru | D142: F | E142: of:=CONCATENATE(IF([.F142]=193;"F";"");IF(AND([.F142]>0;[.F142]<193);"P";"");IF([.F142]=0;"N";"")) -> F | F142: of:=IF([.D142]="F";193;0) -> 193 | G142: 1839-08-25 | H142: Creation of Peru
A143: Philippines | B143: Philippines | C143: Republic of the Philippines | D143: F | E143: of:=CONCATENATE(IF([.F143]=193;"F";"");IF(AND([.F143]>0;[.F143]<193);"P";"");IF([.F143]=0;"N";"")) -> F | F143: of:=IF([.D143]="F";193;0) -> 193 | G143: 1946-07-04 | H143: Creation of Philippines
A144: Palau | B144: Palau | C144: Republic of Palau | D144: F | E144: of:=CONCATENATE(IF([.F144]=193;"F";"");IF(AND([.F144]>0;[.F144]<193);"P";"");IF([.F144]=0;"N";"")) -> F | F144: of:=IF([.D144]="F";193;0) -> 193 | G144: 1994-10-01 | H144: Creation of Palau
A145: Papua New Guinea | B145: Papua New Guinea | C145: Independent State of Papua New Guinea | D145: F | E145: of:=CONCATENATE(IF([.F145]=193;"F";"");IF(AND([.F145]>0;[.F145]<193);"P";"");IF([.F145]=0;"N";"")) -> F | F145: of:=IF([.D145]="F";193;0) -> 193 | G145: 1975-09-16 | H145: Creation of Papua New Guinea
A146: Poland | B146: Poland | C146: Republic of Poland | D146: F | E146: of:=CONCATENATE(IF([.F146]=193;"F";"");IF(AND([.F146]>0;[.F146]<193);"P";"");IF([.F146]=0;"N";"")) -> F | F146: of:=IF([.D146]="F";193;0) -> 193 | G146: 1945-01-01 | H146: Creation of Poland
A147: Dem. Rep. Korea | B147: North Korea | D147: F | E147: of:=CONCATENATE(IF([.F147]=193;"F";"");IF(AND([.F147]>0;[.F147]<193);"P";"");IF([.F147]=0;"N";"")) -> P | F147: 191 | G147: 1948-09-09 | H147: Creation of Democratic People's Republic of Korea
A148: Portugal | B148: Portugal | C148: Portuguese Republic | D148: F | E148: of:=CONCATENATE(IF([.F148]=193;"F";"");IF(AND([.F148]>0;[.F148]<193);"P";"");IF([.F148]=0;"N";"")) -> F | F148: of:=IF([.D148]="F";193;0) -> 193 | G148: 1808-01-01 | H148: Creation of Portugal
A149: Paraguay | B149: Paraguay | C149: Republic of Paraguay | D149: F | E149: of:=CONCATENATE(IF([.F149]=193;"F";"");IF(AND([.F149]>0;[.F149]<193);"P";"");IF([.F149]=0;"N";"")) -> F | F149: of:=IF([.D149]="F";193;0) -> 193 | G149: 1876-01-01 | H149: Creation of Paraguay
A150: Palestine | B150: Palestine | C150: State of Palestine | D150: O | E150: of:=CONCATENATE(IF([.F150]=193;"F";"");IF(AND([.F150]>0;[.F150]<193);"P";"");IF([.F150]=0;"N";"")) -> P | F150: 136 | G150: 1988-11-15 | H150: Declaration of Independence from Israel
A151: Qatar | B151: Qatar | C151: State of Qatar | D151: F | E151: of:=CONCATENATE(IF([.F151]=193;"F";"");IF(AND([.F151]>0;[.F151]<193);"P";"");IF([.F151]=0;"N";"")) -> F | F151: of:=IF([.D151]="F";193;0) -> 193 | G151: 1971-09-03 | H151: Creation of Qatar
A152: Romania | B152: Romania | C152: Romania | D152: F | E152: of:=CONCATENATE(IF([.F152]=193;"F";"");IF(AND([.F152]>0;[.F152]<193);"P";"");IF([.F152]=0;"N";"")) -> F | F152: of:=IF([.D152]="F";193;0) -> 193 | G152: 1958-08-01 | H152: Creation of Romania
A153: Russian Federation | B153: Russia | C153: Russian Federation | D153: F | E153: of:=CONCATENATE(IF([.F153]=193;"F";"");IF(AND([.F153]>0;[.F153]<193);"P";"");IF([.F153]=0;"N";"")) -> F | F153: of:=IF([.D153]="F";193;0) -> 193 | G153: 1480-10-08 | H153: Creation of Russian Federation
A154: Rwanda | B154: Rwanda | C154: Republic of Rwanda | D154: F | E154: of:=CONCATENATE(IF([.F154]=193;"F";"");IF(AND([.F154]>0;[.F154]<193);"P";"");IF([.F154]=0;"N";"")) -> F | F154: of:=IF([.D154]="F";193;0) -> 193 | G154: 1962-07-01 | H154: Creation of Rwanda
A155: Western Sahara | B155: Sahrawi Arab Democratic Republic | C155: Sahrawi Arab Democratic Republic | D155: N | E155: of:=CONCATENATE(IF([.F155]=193;"F";"");IF(AND([.F155]>0;[.F155]<193);"P";"");IF([.F155]=0;"N";"")) -> P | F155: 84 | G155: 1975-12-01 | H155: Declaration of Independende from Spain
A156: Saudi Arabia | B156: Saudi Arabia | C156: Kingdom of Saudi Arabia | D156: F | E156: of:=CONCATENATE(IF([.F156]=193;"F";"");IF(AND([.F156]>0;[.F156]<193);"P";"");IF([.F156]=0;"N";"")) -> F | F156: of:=IF([.D156]="F";193;0) -> 193 | G156: 1919-01-01 | H156: Creation of Saudi Arabia
A157: Sudan | B157: Sudan | C157: Republic of the Sudan | D157: F | E157: of:=CONCATENATE(IF([.F157]=193;"F";"");IF(AND([.F157]>0;[.F157]<193);"P";"");IF([.F157]=0;"N";"")) -> F | F157: of:=IF([.D157]="F";193;0) -> 193 | G157: 1956-01-01 | H157: Creation of Sudan
A158: South Sudan | B158: South Sudan | C158: Republic of South Sudan | D158: F | E158: of:=CONCATENATE(IF([.F158]=193;"F";"");IF(AND([.F158]>0;[.F158]<193);"P";"");IF([.F158]=0;"N";"")) -> F | F158: of:=IF([.D158]="F";193;0) -> 193 | G158: 2011-07-09 | H158: Creation of South ‎Sudan
A159: Senegal | B159: Senegal | C159: Republic of Senegal | D159: F | E159: of:=CONCATENATE(IF([.F159]=193;"F";"");IF(AND([.F159]>0;[.F159]<193);"P";"");IF([.F159]=0;"N";"")) -> F | F159: of:=IF([.D159]="F";193;0) -> 193 | G159: 1960-06-20 | H159: Creation of Senegal
A160: Singapore | B160: Singapore | C160: Republic of Singapore | D160: F | E160: of:=CONCATENATE(IF([.F160]=193;"F";"");IF(AND([.F160]>0;[.F160]<193);"P";"");IF([.F160]=0;"N";"")) -> F | F160: of:=IF([.D160]="F";193;0) -> 193 | G160: 1965-08-09 | H160: Creation of Singapore
A161: Solomon Islands | B161: Solomon Islands | C161: Solomon Islands | D161: F | E161: of:=CONCATENATE(IF([.F161]=193;"F";"");IF(AND([.F161]>0;[.F161]<193);"P";"");IF([.F161]=0;"N";"")) -> F | F161: of:=IF([.D161]="F";193;0) -> 193 | G161: 1978-07-07 | H161: Creation of Solomon Islands
A162: Sierra Leone | B162: Sierra Leone | C162: Republic of Sierra Leone | D162: F | E162: of:=CONCATENATE(IF([.F162]=193;"F";"");IF(AND([.F162]>0;[.F162]<193);"P";"");IF([.F162]=0;"N";"")) -> F | F162: of:=IF([.D162]="F";193;0) -> 193 | G162: 1961-04-27 | H162: Creation of Sierra Leone
A163: El Salvador | B163: El Salvador | C163: Republic of El Salvador | D163: F | E163: of:=CONCATENATE(IF([.F163]=193;"F";"");IF(AND([.F163]>0;[.F163]<193);"P";"");IF([.F163]=0;"N";"")) -> F | F163: of:=IF([.D163]="F";193;0) -> 193 | G163: 1898-11-21 | H163: Creation of El Salvador
A164: San Marino | B164: San Marino | C164: Republic of San Marino | D164: F | E164: of:=CONCATENATE(IF([.F164]=193;"F";"");IF(AND([.F164]>0;[.F164]<193);"P";"");IF([.F164]=0;"N";"")) -> F | F164: of:=IF([.D164]="F";193;0) -> 193 | G164: 1945-01-01 | H164: Creation of San Marino
A165: Somaliland | B165: Somaliland | C165: Republic of Somaliland | D165: N | E165: of:=CONCATENATE(IF([.F165]=193;"F";"");IF(AND([.F165]>0;[.F165]<193);"P";"");IF([.F165]=0;"N";"")) -> N | F165: of:=IF([.D165]="F";193;0) -> 0 | G165: 1991-05-18 | H165: Declaration of Independence from Somalia
A166: Somalia | B166: Somalia | C166: Federal Republic of Somalia | D166: F | E166: of:=CONCATENATE(IF([.F166]=193;"F";"");IF(AND([.F166]>0;[.F166]<193);"P";"");IF([.F166]=0;"N";"")) -> F | F166: of:=IF([.D166]="F";193;0) -> 193 | G166: 1960-07-01 | H166: Creation of Somalia
A167: Serbia | B167: Serbia | C167: Republic of Serbia | D167: F | E167: of:=CONCATENATE(IF([.F167]=193;"F";"");IF(AND([.F167]>0;[.F167]<193);"P";"");IF([.F167]=0;"N";"")) -> F | F167: of:=IF([.D167]="F";193;0) -> 193 | G167: 1945-01-01 | H167: Creation of Serbia
A168: São Tomé and Principe | B168: São Tomé and Príncipe | C168: Democratic Republic of São Tomé and Príncipe | D168: F | E168: of:=CONCATENATE(IF([.F168]=193;"F";"");IF(AND([.F168]>0;[.F168]<193);"P";"");IF([.F168]=0;"N";"")) -> F | F168: of:=IF([.D168]="F";193;0) -> 193 | G168: 1975-07-12 | H168: Creation of Sao Tome and Principe
A169: Suriname | B169: Suriname | C169: Republic of Suriname | D169: F | E169: of:=CONCATENATE(IF([.F169]=193;"F";"");IF(AND([.F169]>0;[.F169]<193);"P";"");IF([.F169]=0;"N";"")) -> F | F169: of:=IF([.D169]="F";193;0) -> 193 | G169: 1975-11-25 | H169: Creation of Suriname
A170: Slovakia | B170: Slovakia | C170: Slovak Republic | D170: F | E170: of:=CONCATENATE(IF([.F170]=193;"F";"");IF(AND([.F170]>0;[.F170]<193);"P";"");IF([.F170]=0;"N";"")) -> F | F170: of:=IF([.D170]="F";193;0) -> 193 | G170: 1993-01-01 | H170: Creation of Slovakia
A171: Slovenia | B171: Slovenia | C171: Republic of Slovenia | D171: F | E171: of:=CONCATENATE(IF([.F171]=193;"F";"");IF(AND([.F171]>0;[.F171]<193);"P";"");IF([.F171]=0;"N";"")) -> F | F171: of:=IF([.D171]="F";193;0) -> 193 | G171: 1991-06-25 | H171: Creation of Slovenia
A172: Sweden | B172: Sweden | C172: Kingdom of Sweden | D172: F | E172: of:=CONCATENATE(IF([.F172]=193;"F";"");IF(AND([.F172]>0;[.F172]<193);"P";"");IF([.F172]=0;"N";"")) -> F | F172: of:=IF([.D172]="F";193;0) -> 193 | G172: 1523-06-06 | H172: Creation of Sweden
A173: Swaziland | B173: Swaziland | C173: Kingdom of Swaziland | D173: F | E173: of:=CONCATENATE(IF([.F173]=193;"F";"");IF(AND([.F173]>0;[.F173]<193);"P";"");IF([.F173]=0;"N";"")) -> F | F173: of:=IF([.D173]="F";193;0) -> 193 | G173: 1968-09-06 | H173: Creation of Swaziland
A174: Seychelles | B174: Seychelles | C174: Republic of Seychelles | D174: F | E174: of:=CONCATENATE(IF([.F174]=193;"F";"");IF(AND([.F174]>0;[.F174]<193);"P";"");IF([.F174]=0;"N";"")) -> F | F174: of:=IF([.D174]="F";193;0) -> 193 | G174: 1976-06-29 | H174: Creation of Seychelles
A175: Syria | B175: Syria | C175: Syrian Arab Republic | D175: F | E175: of:=CONCATENATE(IF([.F175]=193;"F";"");IF(AND([.F175]>0;[.F175]<193);"P";"");IF([.F175]=0;"N";"")) -> F | F175: of:=IF([.D175]="F";193;0) -> 193 | G175: 1961-09-28 | H175: Creation of Syrian Arab Republic
A176: Chad | B176: Chad | C176: Republic of Chad | D176: F | E176: of:=CONCATENATE(IF([.F176]=193;"F";"");IF(AND([.F176]>0;[.F176]<193);"P";"");IF([.F176]=0;"N";"")) -> F | F176: of:=IF([.D176]="F";193;0) -> 193 | G176: 1960-08-11 | H176: Creation of Chad
A177: Togo | B177: Togo | C177: Togolese Republic | D177: F | E177: of:=CONCATENATE(IF([.F177]=193;"F";"");IF(AND([.F177]>0;[.F177]<193);"P";"");IF([.F177]=0;"N";"")) -> F | F177: of:=IF([.D177]="F";193;0) -> 193 | G177: 1960-04-27 | H177: Creation of Togo
A178: Thailand | B178: Thailand | C178: Kingdom of Thailand | D178: F | E178: of:=CONCATENATE(IF([.F178]=193;"F";"");IF(AND([.F178]>0;[.F178]<193);"P";"");IF([.F178]=0;"N";"")) -> F | F178: of:=IF([.D178]="F";193;0) -> 193 | G178: 1945-01-01 | H178: Creation of Thailand
A179: Tajikistan | B179: Tajikistan | C179: Republic of Tajikistan | D179: F | E179: of:=CONCATENATE(IF([.F179]=193;"F";"");IF(AND([.F179]>0;[.F179]<193);"P";"");IF([.F179]=0;"N";"")) -> F | F179: of:=IF([.D179]="F";193;0) -> 193 | G179: 1991-09-09 | H179: Creation of Tajikistan
A180: Turkmenistan | B180: Turkmenistan | C180: Turkmenistan | D180: F | E180: of:=CONCATENATE(IF([.F180]=193;"F";"");IF(AND([.F180]>0;[.F180]<193);"P";"");IF([.F180]=0;"N";"")) -> F | F180: of:=IF([.D180]="F";193;0) -> 193 | G180: 1991-10-27 | H180: Creation of Turkmenistan
A181: Timor-Leste | B181: East Timor | C181: Democratic Republic of Timor-Leste | D181: F | E181: of:=CONCATENATE(IF([.F181]=193;"F";"");IF(AND([.F181]>0;[.F181]<193);"P";"");IF([.F181]=0;"N";"")) -> F | F181: of:=IF([.D181]="F";193;0) -> 193 | G181: 2002-05-20 | H181: Creation of Timor-Leste
A182: Tonga | B182: Tonga | C182: Kingdom of Tonga | D182: F | E182: of:=CONCATENATE(IF([.F182]=193;"F";"");IF(AND([.F182]>0;[.F182]<193);"P";"");IF([.F182]=0;"N";"")) -> F | F182: of:=IF([.D182]="F";193;0) -> 193 | G182: 1970-06-04 | H182: Creation of Tonga
A183: Trinidad and Tobago | B183: Trinidad and Tobago | C183: Republic of Trinidad and Tobago | D183: F | E183: of:=CONCATENATE(IF([.F183]=193;"F";"");IF(AND([.F183]>0;[.F183]<193);"P";"");IF([.F183]=0;"N";"")) -> F | F183: of:=IF([.D183]="F";193;0) -> 193 | G183: 1962-08-31 | H183: Creation of Trinidad and Tobago
A184: Tunisia | B184: Tunisia | C184: Republic of Tunisia | D184: F | E184: of:=CONCATENATE(IF([.F184]=193;"F";"");IF(AND([.F184]>0;[.F184]<193);"P";"");IF([.F184]=0;"N";"")) -> F | F184: of:=IF([.D184]="F";193;0) -> 193 | G184: 1956-03-20 | H184: Creation of Tunisia
A185: Turkey | B185: Turkey | C185: Republic of Turkey | D185: F | E185: of:=CONCATENATE(IF([.F185]=193;"F";"");IF(AND([.F185]>0;[.F185]<193);"P";"");IF([.F185]=0;"N";"")) -> F | F185: of:=IF([.D185]="F";193;0) -> 193 | G185: 1243-06-26 | H185: Creation of Turkey
A186: Taiwan | B186: Taiwan | C186: Republic of China | D186: P | E186: of:=CONCATENATE(IF([.F186]=193;"F";"");IF(AND([.F186]>0;[.F186]<193);"P";"");IF([.F186]=0;"N";"")) -> P | F186: 20 | G186: 1912-01-12 | H186: Constitution of Republic of China
A187: Tanzania | B187: Tanzania | C187: United Republic of Tanzania | D187: F | E187: of:=CONCATENATE(IF([.F187]=193;"F";"");IF(AND([.F187]>0;[.F187]<193);"P";"");IF([.F187]=0;"N";"")) -> F | F187: of:=IF([.D187]="F";193;0) -> 193 | G187: 1961-12-09 | H187: Creation of United Republic of Tanzania
A188: Uganda | B188: Uganda | C188: Republic of Uganda | D188: F | E188: of:=CONCATENATE(IF([.F188]=193;"F";"");IF(AND([.F188]>0;[.F188]<193);"P";"");IF([.F188]=0;"N";"")) -> F | F188: of:=IF([.D188]="F";193;0) -> 193 | G188: 1962-10-09 | H188: Creation of Uganda
A189: Ukraine | B189: Ukraine | C189: Ukraine | D189: F | E189: of:=CONCATENATE(IF([.F189]=193;"F";"");IF(AND([.F189]>0;[.F189]<193);"P";"");IF([.F189]=0;"N";"")) -> F | F189: of:=IF([.D189]="F";193;0) -> 193 | G189: 1991-08-24 | H189: Creation of Ukraine
A190: Uruguay | B190: Uruguay | C190: Oriental Republic of Uruguay | D190: F | E190: of:=CONCATENATE(IF([.F190]=193;"F";"");IF(AND([.F190]>0;[.F190]<193);"P";"");IF([.F190]=0;"N";"")) -> F | F190: of:=IF([.D190]="F";193;0) -> 193 | G190: 1828-08-27 | H190: Creation of Uruguay
A191: United States | B191: United States | C191: United States of America | D191: F | E191: of:=CONCATENATE(IF([.F191]=193;"F";"");IF(AND([.F191]>0;[.F191]<193);"P";"");IF([.F191]=0;"N";"")) -> F | F191: of:=IF([.D191]="F";193;0) -> 193 | G191: 1781-10-19 | H191: Creation of United States of America
A192: Uzbekistan | B192: Uzbekistan | C192: Republic of Uzbekistan | D192: F | E192: of:=CONCATENATE(IF([.F192]=193;"F";"");IF(AND([.F192]>0;[.F192]<193);"P";"");IF([.F192]=0;"N";"")) -> F | F192: of:=IF([.D192]="F";193;0) -> 193 | G192: 1991-09-01 | H192: Creation of Uzbekistan
A193: Vatican | B193: Vatican City | C193: Vatican City State | D193: O | E193: of:=CONCATENATE(IF([.F193]=193;"F";"");IF(AND([.F193]>0;[.F193]<193);"P";"");IF([.F193]=0;"N";"")) -> F | F193: 193 | G193: 1929-02-11 | H193: Creation of Vatican City
A194: Saint Vincent and the Grenadines | B194: Saint Vincent and the Grenadines | C194: Saint Vincent and the Grenadines | D194: F | E194: of:=CONCATENATE(IF([.F194]=193;"F";"");IF(AND([.F194]>0;[.F194]<193);"P";"");IF([.F194]=0;"N";"")) -> F | F194: of:=IF([.D194]="F";193;0) -> 193 | G194: 1979-10-27 | H194: Creation of Saint Vincent and the Grenadines
A195: Venezuela | B195: Venezuela | C195: Bolivarian Republic of Venezuela | D195: F | E195: of:=CONCATENATE(IF([.F195]=193;"F";"");IF(AND([.F195]>0;[.F195]<193);"P";"");IF([.F195]=0;"N";"")) -> F | F195: of:=IF([.D195]="F";193;0) -> 193 | G195: 1830-01-13 | H195: Creation of Venezuela
A196: Vietnam | B196: Vietnam | C196: Socialist Republic of Vietnam | D196: F | E196: of:=CONCATENATE(IF([.F196]=193;"F";"");IF(AND([.F196]>0;[.F196]<193);"P";"");IF([.F196]=0;"N";"")) -> F | F196: of:=IF([.D196]="F";193;0) -> 193 | G196: 1954-01-01 | H196: Creation of Viet Nam
A197: Vanuatu | B197: Vanuatu | C197: Republic of Vanuatu | D197: F | E197: of:=CONCATENATE(IF([.F197]=193;"F";"");IF(AND([.F197]>0;[.F197]<193);"P";"");IF([.F197]=0;"N";"")) -> F | F197: of:=IF([.D197]="F";193;0) -> 193 | G197: 1980-07-30 | H197: Creation of Vanuatu
A198: Samoa | B198: Samoa | C198: Independent State of Samoa | D198: F | E198: of:=CONCATENATE(IF([.F198]=193;"F";"");IF(AND([.F198]>0;[.F198]<193);"P";"");IF([.F198]=0;"N";"")) -> F | F198: of:=IF([.D198]="F";193;0) -> 193 | G198: 1962-01-01 | H198: Creation of Samoa
A199: Yemen | B199: Yemen | C199: Republic of Yemen | D199: F | E199: of:=CONCATENATE(IF([.F199]=193;"F";"");IF(AND([.F199]>0;[.F199]<193);"P";"");IF([.F199]=0;"N";"")) -> F | F199: of:=IF([.D199]="F";193;0) -> 193 | G199: 1967-11-30 | H199: Creation of Yemen
A200: South Africa | B200: South Africa | C200: Republic of South Africa | D200: F | E200: of:=CONCATENATE(IF([.F200]=193;"F";"");IF(AND([.F200]>0;[.F200]<193);"P";"");IF([.F200]=0;"N";"")) -> F | F200: of:=IF([.D200]="F";193;0) -> 193 | G200: 1931-12-11 | H200: Creation of South Africa
A201: Zambia | B201: Zambia | C201: Republic of Zambia | D201: F | E201: of:=CONCATENATE(IF([.F201]=193;"F";"");IF(AND([.F201]>0;[.F201]<193);"P";"");IF([.F201]=0;"N";"")) -> F | F201: of:=IF([.D201]="F";193;0) -> 193 | G201: 1964-10-24 | H201: Creation of Zambia
A202: Zimbabwe | B202: Zimbabwe | C202: Republic of Zimbabwe | D202: F | E202: of:=CONCATENATE(IF([.F202]=193;"F";"");IF(AND([.F202]>0;[.F202]<193);"P";"");IF([.F202]=0;"N";"")) -> F | F202: of:=IF([.D202]="F";193;0) -> 193 | G202: 1980-04-18 | H202: Creation of Zimbabwe

Sheet: areas_to_create
A1: name_short | B1: name_formal | C1: international_status | D1: sovereignty_status | E1: UN_member_recognition | F1: non_UN_member_recognition | G1: creation_date | H1: hivent_name | I1: operation | J1: old_area | K1: source
A2: Tuvalu | B2: Tuvalu | C2: F | D2: of:=CONCATENATE(IF([.E2]=193;"F";"");IF(AND([.E2]>0;[.E2]<193);"P";"");IF([.E2]=0;"N";"")) -> F | E2: of:=IF([areas_to_create.C2]="F";193;0) -> 193 | G2: 1978-10-01 | H2: Creation of Tuvalu | I2: ADD | K2: Tuvalu_add.geojson
A3: Nagorno-Karabakh | B3: Nagorno-Karabakh Republic | C3: N | D3: of:=CONCATENATE(IF([.E3]=193;"F";"");IF(AND([.E3]>0;[.E3]<193);"P";"");IF([.E3]=0;"N";"")) -> N | E3: 0 | F3: 3 | G3: 1991-09-02 | H3: Declaration of Independence from Azerbaijan | I3: SEP | J3: Azerbaijan | K3: Nagorno_Karabakh_clip.geojson
A4: Transnistria | B4: Pridnestrovian Moldavian Republic | C4: N | D4: of:=CONCATENATE(IF([.E4]=193;"F";"");IF(AND([.E4]>0;[.E4]<193);"P";"");IF([.E4]=0;"N";"")) -> N | E4: 0 | F4: 3 | G4: 1990-09-02 | H4: Declaration of Independence from Moldova | I4: SEP | J4: Moldova | K4: Transnistria_clip.geojson
A5: Abkhazia | B5: Republic of Abkhazia | C5: N | D5: of:=CONCATENATE(IF([.E5]=193;"F";"");IF(AND([.E5]>0;[.E5]<193);"P";"");IF([.E5]=0;"N";"")) -> P | E5: 6 | F5: 3 | G5: 1999-10-12 | H5: Act of State Independence from Georgia | I5: SEP | J5: Georgia | K5: Abkhazia_clip.geojson
A6: South Ossetia | B6: Republic of South Ossetia | C6: N | D6: of:=CONCATENATE(IF([.E6]=193;"F";"");IF(AND([.E6]>0;[.E6]<193);"P";"");IF([.E6]=0;"N";"")) -> P | E6: 5 | F6: 3 | G6: 1991-12-21 | H6: Declaration of Independence from Georgia | I6: SEP | J6: Georgia | K6: South_Ossetia_clip.geojson

Sheet: areas_to_merge
A1: init_source_name | B1: name_short | C1: name_formal | D1: part_of | E1: territory_of
A2: Aruba | B2: Aruba | C2: Aruba | D2: Netherlands
A3: Anguilla | B3: Anguilla | C3: Anguilla | E3: United Kingdom
A4: Aland Islands | B4: Aland Islands | C4: Aland Islands | D4: Finland
A5: American Samoa | B5: American Samoa | C5: American Samoa | E5: United States
A6: Ashmore and Cartier Islands | B6: Ashmore and Cartier Islands | C6: Ashmore and Cartier Islands | E6: Australia
A7: French Southern and Antarctic Lands | B7: French Southern and Antarctic Lands | C7: French Southern and Antarctic Lands | E7: France
A8: Saint-Barthélemy | B8: Saint-Barthélemy | C8: Saint-Barthélemy | E8: France
A9: Bermuda | B9: Bermuda | C9: Bermuda | E9: United Kingdom
A10: Curaçao | B10: Curacao | C10: Curacao | D10: Netherlands
A11: Cayman Islands | B11: Cayman Islands | C11: Cayman Islands | E11: United Kingdom
A12: Falkland Islands | B12: Falkland Islands | C12: Falkland Islands | E12: United Kingdom
A13: Faeroe Islands | B13: Faeroe Islands | C13: Faeroe Islands | E13: Denmark
A14: Guernsey | B14: Guernsey | C14: Guernsey | E14: United Kingdom
A15: Greenland | B15: Greenland | C15: Greenland | E15: Denmark
A16: Guam | B16: Guam | C16: Guam | E16: United States
A17: Hong Kong | B17: Hong Kong | C17: Hong Kong | E17: China
A18: Heard I. and McDonald Islands | B18: Heard I. and McDonald Islands | C18: Heard I. and McDonald Islands | E18: Australia
A19: Isle of Man | B19: Isle of Man | C19: Isle of Man | E19: United Kingdom
A20: Indian Ocean Territories | B20: Indian Ocean Territories | C20: Indian Ocean Territories | E20: Australia
A21: British Indian Ocean Territory | B21: British Indian Ocean Territory | C21: British Indian Ocean Territory | E21: United Kingdom
A22: Jersey | B22: Jersey | C22: Jersey | E22: United Kingdom
A23: Siachen Glacier | D23: India
A24: Macao | B24: Macao | C24: Macao | E24: China
A25: Saint-Martin | B25: Saint-Martin | C25: Saint-Martin | E25: France
A26: Northern Mariana Islands | B26: Northern Mariana Islands | C26: Northern Mariana Islands | E26: United States
A27: Montserrat | B27: Montserrat | C27: Montserrat | E27: United Kingdom
A28: New Caledonia | B28: New Caledonia | C28: New Caledonia | E28: France
A29: Norfolk Island | B29: Norfolk Island | C29: Norfolk Island | E29: Australia
A30: Pitcairn Islands | B30: Pitcairn Islands | C30: Pitcairn Islands | E30: United Kingdom
A31: Puerto Rico | B31: Puerto Rico | C31: Puerto Rico | E31: United States
A32: French Polynesia | B32: French Polynesia | C32: French Polynesia | E32: France
A33: South Georgia and South Sandwich Islands | B33: South Georgia and South Sandwich Islands | C33: South Georgia and South Sandwich Islands | E33: United Kingdom
A34: Saint Helena | B34: Saint Helena | C34: Saint Helena | E34: United Kingdom
A35: Saint Pierre and Miquelon | B35: Saint Pierre and Miquelon | C35: Saint Pierre and Miquelon | E35: France
A36: Sint Maarten | B36: Sint Maarten | C36: Sint Maarten | D36: Netherlands
A37: Turks and Caicos Islands | B37: Turks and Caicos Islands | C37: Turks and Caicos Islands | E37: United Kingdom
A38: British Virgin Islands | B38: British Virgin Islands | C38: British Virgin Islands | E38: United Kingdom
A39: United States Virgin Islands | B39: United States Virgin Islands | C39: United States Virgin Islands | E39: United States
A40: Wallis and Futuna Islands | B40: Wallis and Futuna Islands | C40: Wallis and Futuna Islands | E40: France

Sheet: areas_to_delete
A1: init_source_name
A2: Antarctica

Sheet: name_mapping
A1: Afghanistan | B1: Islamic Republic of Afghanistan
A2: Albania | B2: Republic of Albania
A3: Algeria | B3: People's Democratic Republic of Algeria
A4: Andorra | B4: Principality of Andorra
A5: Angola | B5: Republic of Angola
A6: Antigua and Barbuda | B6: Antigua and Barbuda
A7: Argentina | B7: Argentine Republic
A8: Armenia | B8: Republic of Armenia
A9: Australia | B9: Commonwealth of Australia
A10: Austria | B10: Republic of Austria
A11: Azerbaijan | B11: Republic of Azerbaijan
A12: The Bahamas | B12: Commonwealth of the Bahamas
A13: Bahrain | B13: Kingdom of Bahrain
A14: Bangladesh | B14: People's Republic of Bangladesh
A15: Barbados | B15: Barbados
A16: Belarus | B16: Republic of Belarus
A17: Belgium | B17: Kingdom of Belgium
A18: Belize | B18: Belize
A19: Benin | B19: Republic of Benin
A20: Bhutan | B20: Kingdom of Bhutan
A21: Bolivia | B21: Plurinational State of Bolivia
A22: Bosnia and Herzegovina | B22: Bosnia and Herzegovina
A23: Botswana | B23: Republic of Botswana
A24: Brazil | B24: Federative Republic of Brazil
A25: Brunei | B25: Nation of Brunei, Abode of Peace
A26: Bulgaria | B26: Republic of Bulgaria
A27: Burkina Faso | B27: Burkina Faso
A28: Burundi | B28: Republic of Burundi
A29: Cambodia | B29: Kingdom of Cambodia
A30: Cameroon | B30: Republic of Cameroon
A31: Canada | B31: Canada
A32: Cape Verde | B32: Republic of Cabo Verde
A33: Central African Republic | B33: Central African Republic
A34: Chad | B34: Republic of Chad
A35: Chile | B35: Republic of Chile
A36: China | B36: People's Republic of China
A37: Colombia | B37: Republic of Colombia
A38: Comoros | B38: Union of the Comoros
A39: Democratic Republic of the Congo | B39: Democratic Republic of the Congo
A40: Republic of the Congo | B40: Republic of the Congo
A41: Costa Rica | B41: Republic of Costa Rica
A42: Croatia | B42: Republic of Croatia
A43: Cuba | B43: Republic of Cuba
A44: Cyprus | B44: Republic of Cyprus
A45: Czech Republic | B45: Czech Republic
A46: Denmark | B46: Kingdom of Denmark
A47: Djibouti | B47: Republic of Djibouti
A48: Dominica | B48: Commonwealth of Dominica
A49: Dominican Republic | B49: Dominican Republic
A50: East Timor | B50: Democratic Republic of Timor-Leste
A51: Ecuador | B51: Republic of Ecuador
A52: Egypt | B52: Arab Republic of Egypt
A53: El Salvador | B53: Republic of El Salvador
A54: Equatorial Guinea | B54: Republic of Equatorial Guinea
A55: Eritrea | B55: State of Eritrea
A56: Estonia | B56: Republic of Estonia
A57: Ethiopia | B57: Federal Democratic Republic of Ethiopia
A58: Federated States of Micronesia | B58: Federated States of Micronesia
A59: Fiji | B59: Republic of Fiji
A60: Finland | B60: Republic of Finland
A61: France | B61: French Republic
A62: Gabon | B62: Gabonese Republic
A63: The Gambia | B63: Republic of the Gambia
A64: Georgia | B64: Georgia
A65: Germany | B65: Federal Republic of Germany
A66: Ghana | B66: Republic of Ghana
A67: Greece | B67: Hellenic Republic
A68: Grenada | B68: Grenada
A69: Guatemala | B69: Republic of Guatemala
A70: Guinea | B70: Republic of Guinea
A71: Guinea-Bissau | B71: Republic of Guinea-Bissau
A72: Guyana | B72: Co-operative Republic of Guyana
A73: Haiti | B73: Republic of Haiti
A74: Honduras | B74: Republic of Honduras
A75: Hungary | B75: Hungary
A76: Iceland | B76: Iceland
A77: India | B77: Republic of India
A78: Indonesia | B78: Republic of Indonesia
A79: Iran | B79: Islamic Republic of Iran
A80: Iraq | B80: Republic of Iraq
A81: Ireland | B81: Ireland
A82: Israel | B82: State of Israel
A83: Italy | B83: Italian Republic
A84: Ivory Coast | B84: Republic of Côte d'Ivoire
A85: Jamaica | B85: Jamaica
A86: Japan | B86: Japan
A87: Jordan | B87: Hashemite Kingdom of Jordan
A88: Kazakhstan | B88: Republic of Kazakhstan
A89: Kenya | B89: Republic of Kenya
A90: Kiribati | B90: Republic of Kiribati
A91: Korea, North | B91: Democratic People's Republic of Korea
A92: Korea, South | B92: Republic of Korea
A93: Kuwait | B93: State of Kuwait
A94: Kyrgyzstan | B94: Kyrgyz Republic
A95: Laos | B95: Lao People's Democratic Republic
A96: Latvia | B96: Republic of Latvia
A97: Lebanon | B97: Lebanese Republic
A98: Lesotho | B98: Kingdom of Lesotho
A99: Liberia | B99: Republic of Liberia
A100: Libya | B100: State of Libya
A101: Liechtenstein | B101: Principality of Liechtenstein
A102: Lithuania | B102: Republic of Lithuania
A103: Luxembourg | B103: Grand Duchy of Luxembourg
A104: Macedonia | B104: Republic of Macedonia
A105: Madagascar | B105: Republic of Madagascar
A106: Malawi | B106: Republic of Malawi
A107: Malaysia | B107: Malaysia
A108: Maldives | B108: Republic of Maldives
A109: Mali | B109: Republic of Mali
A110: Malta | B110: Republic of Malta
A111: Marshall Islands | B111: Republic of the Marshall Islands
A112: Mauritania | B112: Islamic Republic of Mauritania
A113: Mauritius | B113: Republic of Mauritius
A114: Mexico | B114: United Mexican States
A115: Moldova | B115: Republic of Moldova
A116: Monaco | B116: Principality of Monaco
A117: Mongolia | B117: Mongolia
A118: Montenegro | B118: Montenegro
A119: Morocco | B119: Kingdom of Morocco
A120: Mozambique | B120: Republic of Mozambique
A121: Myanmar | B121: Republic of the Union of Myanmar
A122: Namibia | B122: Republic of Namibia
A123: Nauru | B123: Republic of Nauru
A124: Nepal | B124: Federal Democratic Republic of Nepal
A125: Netherlands | B125: Kingdom of the Netherlands
A126: New Zealand | B126: New Zealand
A127: Nicaragua | B127: Republic of Nicaragua
A128: Niger | B128: Republic of Niger
A129: Nigeria | B129: Federal Republic of Nigeria
A130: Norway | B130: Kingdom of Norway
A131: Oman | B131: Sultanate of Oman
A132: Pakistan | B132: Islamic Republic of Pakistan
A133: Palau | B133: Republic of Palau
A134: Palestine | B134: State of Palestine
A135: Panama | B135: Republic of Panama
A136: Papua New Guinea | B136: Independent State of Papua New Guinea
A137: Paraguay | B137: Republic of Paraguay
A138: Peru | B138: Republic of Peru
A139: Philippines | B139: Republic of the Philippines
A140: Poland | B140: Republic of Poland
A141: Portugal | B141: Portuguese Republic
A142: Qatar | B142: State of Qatar
A143: Romania | B143: Romania
A144: Russia | B144: Russian Federation
A145: Rwanda | B145: Republic of Rwanda
A146: Saint Kitts and Nevis | B146: Federation of Saint Christopher and Nevis
A147: Saint Lucia | B147: Saint Lucia
A148: Saint Vincent and the Grenadines | B148: Saint Vincent and the Grenadines
A149: Samoa | B149: Independent State of Samoa
A150: San Marino | B150: Republic of San Marino
A151: São Tomé and Príncipe | B151: Democratic Republic of São Tomé and Príncipe
A152: Saudi Arabia | B152: Kingdom of Saudi Arabia
A153: Senegal | B153: Republic of Senegal
A154: Serbia | B154: Republic of Serbia
A155: Seychelles | B155: Republic of Seychelles
A156: Sierra Leone | B156: Republic of Sierra Leone
A157: Singapore | B157: Republic of Singapore
A158: Slovakia | B158: Slovak Republic
A159: Slovenia | B159: Republic of Slovenia
A160: Solomon Islands | B160: Solomon Islands
A161: Somalia | B161: Federal Republic of Somalia
A162: South Africa | B162: Republic of South Africa
A163: South Sudan | B163: Republic of South Sudan
A164: Spain | B164: Kingdom of Spain
A165: Sri Lanka | B165: Democratic Socialist Republic of Sri Lanka
A166: Sudan | B166: Republic of the Sudan
A167: Suriname | B167: Republic of Suriname
A168: Swaziland | B168: Kingdom of Swaziland
A169: Sweden | B169: Kingdom of Sweden
A170: Switzerland | B170: Swiss Confederation
A171: Syria | B171: Syrian Arab Republic
A172: Tajikistan | B172: Republic of Tajikistan
A173: Tanzania | B173: United Republic of Tanzania
A174: Thailand | B174: Kingdom of Thailand
A175: Togo | B175: Togolese Republic
A176: Tonga | B176: Kingdom of Tonga
A177: Trinidad and Tobago | B177: Republic of Trinidad and Tobago
A178: Tunisia | B178: Republic of Tunisia
A179: Turkey | B179: Republic of Turkey
A180: Turkmenistan | B180: Turkmenistan
A181: Tuvalu | B181: Tuvalu
A182: Uganda | B182: Republic of Uganda
A183: Ukraine | B183: Ukraine
A184: United Arab Emirates | B184: United Arab Emirates
A185: United Kingdom | B185: United Kingdom of Great Britain and Northern Ireland
A186: United States | B186: United States of America
A187: Uruguay | B187: Oriental Republic of Uruguay
A188: Uzbekistan | B188: Republic of Uzbekistan
A189: Vanuatu | B189: Republic of Vanuatu
A190: Vatican City | B190: Vatican City State
A191: Venezuela | B191: Bolivarian Republic of Venezuela
A192: Vietnam | B192: Socialist Republic of Vietnam
A193: Yemen | B193: Republic of Yemen
A194: Zambia | B194: Republic of Zambia
A195: Zimbabwe | B195: Republic of Zimbabwe
A196: Abkhazia | B196: Republic of Abkhazia
A197: Cook Islands | B197: Cook Islands
A198: Kosovo | B198: Republic of Kosovo
A199: Nagorno-Karabakh | B199: Nagorno-Karabakh Republic
A200: Niue | B200: Niue
A201: Northern Cyprus | B201: Turkish Republic of Northern Cyprus
A202: Sahrawi Arab Democratic Republic | B202: Sahrawi Arab Democratic Republic
A203: Somaliland | B203: Republic of Somaliland
A204: South Ossetia | B204: Republic of South Ossetia
A205: Taiwan | B205: Republic of China
A206: Transnistria | B206: Pridnestrovian Moldavian Republic